[
  {
    "evidence_id": "block0",
    "label": "block",
    "rater": "synthetic-r1",
    "schema_version": "1.0",
    "snapshot_sha256": "f4d9551798291aac855cf64764981c9b72ee536f21520cc908432d7bc58b1091",
    "source": "synthetic",
    "split": "heldout",
    "target_id": "block0"
  },
  {
    "evidence_id": "block0",
    "label": "block",
    "rater": "synthetic-r2",
    "schema_version": "1.0",
    "snapshot_sha256": "f4d9551798291aac855cf64764981c9b72ee536f21520cc908432d7bc58b1091",
    "source": "synthetic",
    "split": "heldout",
    "target_id": "block0"
  },
  {
    "evidence_id": "block1",
    "label": "block",
    "rater": "synthetic-r1",
    "schema_version": "1.0",
    "snapshot_sha256": "f4d9551798291aac855cf64764981c9b72ee536f21520cc908432d7bc58b1091",
    "source": "synthetic",
    "split": "heldout",
    "target_id": "block1"
  },
  {
    "evidence_id": "block1",
    "label": "block",
    "rater": "synthetic-r2",
    "schema_version": "1.0",
    "snapshot_sha256": "f4d9551798291aac855cf64764981c9b72ee536f21520cc908432d7bc58b1091",
    "source": "synthetic",
    "split": "heldout",
    "target_id": "block1"
  },
  {
    "evidence_id": "block2",
    "label": "block",
    "rater": "synthetic-r1",
    "schema_version": "1.0",
    "snapshot_sha256": "f4d9551798291aac855cf64764981c9b72ee536f21520cc908432d7bc58b1091",
    "source": "synthetic",
    "split": "heldout",
    "target_id": "block2"
  },
  {
    "evidence_id": "block2",
    "label": "block",
    "rater": "synthetic-r2",
    "schema_version": "1.0",
    "snapshot_sha256": "f4d9551798291aac855cf64764981c9b72ee536f21520cc908432d7bc58b1091",
    "source": "synthetic",
    "split": "heldout",
    "target_id": "block2"
  },
  {
    "evidence_id": "block3",
    "label": "block",
    "rater": "synthetic-r1",
    "schema_version": "1.0",
    "snapshot_sha256": "f4d9551798291aac855cf64764981c9b72ee536f21520cc908432d7bc58b1091",
    "source": "synthetic",
    "split": "heldout",
    "target_id": "block3"
  },
  {
    "evidence_id": "block3",
    "label": "block",
    "rater": "synthetic-r2",
    "schema_version": "1.0",
    "snapshot_sha256": "f4d9551798291aac855cf64764981c9b72ee536f21520cc908432d7bc58b1091",
    "source": "synthetic",
    "split": "heldout",
    "target_id": "block3"
  },
  {
    "evidence_id": "block4",
    "label": "block",
    "rater": "synthetic-r1",
    "schema_version": "1.0",
    "snapshot_sha256": "f4d9551798291aac855cf64764981c9b72ee536f21520cc908432d7bc58b1091",
    "source": "synthetic",
    "split": "heldout",
    "target_id": "block4"
  },
  {
    "evidence_id": "block4",
    "label": "block",
    "rater": "synthetic-r2",
    "schema_version": "1.0",
    "snapshot_sha256": "f4d9551798291aac855cf64764981c9b72ee536f21520cc908432d7bc58b1091",
    "source": "synthetic",
    "split": "heldout",
    "target_id": "block4"
  },
  {
    "evidence_id": "block5",
    "label": "block",
    "rater": "synthetic-r1",
    "schema_version": "1.0",
    "snapshot_sha256": "f4d9551798291aac855cf64764981c9b72ee536f21520cc908432d7bc58b1091",
    "source": "synthetic",
    "split": "heldout",
    "target_id": "block5"
  },
  {
    "evidence_id": "block5",
    "label": "block",
    "rater": "synthetic-r2",
    "schema_version": "1.0",
    "snapshot_sha256": "f4d9551798291aac855cf64764981c9b72ee536f21520cc908432d7bc58b1091",
    "source": "synthetic",
    "split": "heldout",
    "target_id": "block5"
  },
  {
    "evidence_id": "block6",
    "label": "block",
    "rater": "synthetic-r1",
    "schema_version": "1.0",
    "snapshot_sha256": "f4d9551798291aac855cf64764981c9b72ee536f21520cc908432d7bc58b1091",
    "source": "synthetic",
    "split": "heldout",
    "target_id": "block6"
  },
  {
    "evidence_id": "block6",
    "label": "block",
    "rater": "synthetic-r2",
    "schema_version": "1.0",
    "snapshot_sha256": "f4d9551798291aac855cf64764981c9b72ee536f21520cc908432d7bc58b1091",
    "source": "synthetic",
    "split": "heldout",
    "target_id": "block6"
  },
  {
    "evidence_id": "block7",
    "label": "block",
    "rater": "synthetic-r1",
    "schema_version": "1.0",
    "snapshot_sha256": "f4d9551798291aac855cf64764981c9b72ee536f21520cc908432d7bc58b1091",
    "source": "synthetic",
    "split": "heldout",
    "target_id": "block7"
  },
  {
    "evidence_id": "block7",
    "label": "block",
    "rater": "synthetic-r2",
    "schema_version": "1.0",
    "snapshot_sha256": "f4d9551798291aac855cf64764981c9b72ee536f21520cc908432d7bc58b1091",
    "source": "synthetic",
    "split": "heldout",
    "target_id": "block7"
  },
  {
    "evidence_id": "captcha0",
    "label": "captcha",
    "rater": "synthetic-r1",
    "schema_version": "1.0",
    "snapshot_sha256": "e22bbd5925a8264bea2dc040144314acc166202e126a1f87d2829afbcd12c28c",
    "source": "synthetic",
    "split": "heldout",
    "target_id": "captcha0"
  },
  {
    "evidence_id": "captcha0",
    "label": "captcha",
    "rater": "synthetic-r2",
    "schema_version": "1.0",
    "snapshot_sha256": "e22bbd5925a8264bea2dc040144314acc166202e126a1f87d2829afbcd12c28c",
    "source": "synthetic",
    "split": "heldout",
    "target_id": "captcha0"
  },
  {
    "evidence_id": "captcha1",
    "label": "captcha",
    "rater": "synthetic-r1",
    "schema_version": "1.0",
    "snapshot_sha256": "e22bbd5925a8264bea2dc040144314acc166202e126a1f87d2829afbcd12c28c",
    "source": "synthetic",
    "split": "heldout",
    "target_id": "captcha1"
  },
  {
    "evidence_id": "captcha1",
    "label": "captcha",
    "rater": "synthetic-r2",
    "schema_version": "1.0",
    "snapshot_sha256": "e22bbd5925a8264bea2dc040144314acc166202e126a1f87d2829afbcd12c28c",
    "source": "synthetic",
    "split": "heldout",
    "target_id": "captcha1"
  },
  {
    "evidence_id": "captcha2",
    "label": "captcha",
    "rater": "synthetic-r1",
    "schema_version": "1.0",
    "snapshot_sha256": "e22bbd5925a8264bea2dc040144314acc166202e126a1f87d2829afbcd12c28c",
    "source": "synthetic",
    "split": "heldout",
    "target_id": "captcha2"
  },
  {
    "evidence_id": "captcha2",
    "label": "captcha",
    "rater": "synthetic-r2",
    "schema_version": "1.0",
    "snapshot_sha256": "e22bbd5925a8264bea2dc040144314acc166202e126a1f87d2829afbcd12c28c",
    "source": "synthetic",
    "split": "heldout",
    "target_id": "captcha2"
  },
  {
    "evidence_id": "captcha3",
    "label": "captcha",
    "rater": "synthetic-r1",
    "schema_version": "1.0",
    "snapshot_sha256": "e22bbd5925a8264bea2dc040144314acc166202e126a1f87d2829afbcd12c28c",
    "source": "synthetic",
    "split": "heldout",
    "target_id": "captcha3"
  },
  {
    "evidence_id": "captcha3",
    "label": "captcha",
    "rater": "synthetic-r2",
    "schema_version": "1.0",
    "snapshot_sha256": "e22bbd5925a8264bea2dc040144314acc166202e126a1f87d2829afbcd12c28c",
    "source": "synthetic",
    "split": "heldout",
    "target_id": "captcha3"
  },
  {
    "evidence_id": "captcha4",
    "label": "captcha",
    "rater": "synthetic-r1",
    "schema_version": "1.0",
    "snapshot_sha256": "e22bbd5925a8264bea2dc040144314acc166202e126a1f87d2829afbcd12c28c",
    "source": "synthetic",
    "split": "heldout",
    "target_id": "captcha4"
  },
  {
    "evidence_id": "captcha4",
    "label": "captcha",
    "rater": "synthetic-r2",
    "schema_version": "1.0",
    "snapshot_sha256": "e22bbd5925a8264bea2dc040144314acc166202e126a1f87d2829afbcd12c28c",
    "source": "synthetic",
    "split": "heldout",
    "target_id": "captcha4"
  },
  {
    "evidence_id": "captcha5",
    "label": "captcha",
    "rater": "synthetic-r1",
    "schema_version": "1.0",
    "snapshot_sha256": "e22bbd5925a8264bea2dc040144314acc166202e126a1f87d2829afbcd12c28c",
    "source": "synthetic",
    "split": "heldout",
    "target_id": "captcha5"
  },
  {
    "evidence_id": "captcha5",
    "label": "captcha",
    "rater": "synthetic-r2",
    "schema_version": "1.0",
    "snapshot_sha256": "e22bbd5925a8264bea2dc040144314acc166202e126a1f87d2829afbcd12c28c",
    "source": "synthetic",
    "split": "heldout",
    "target_id": "captcha5"
  },
  {
    "evidence_id": "captcha6",
    "label": "captcha",
    "rater": "synthetic-r1",
    "schema_version": "1.0",
    "snapshot_sha256": "e22bbd5925a8264bea2dc040144314acc166202e126a1f87d2829afbcd12c28c",
    "source": "synthetic",
    "split": "heldout",
    "target_id": "captcha6"
  },
  {
    "evidence_id": "captcha6",
    "label": "captcha",
    "rater": "synthetic-r2",
    "schema_version": "1.0",
    "snapshot_sha256": "e22bbd5925a8264bea2dc040144314acc166202e126a1f87d2829afbcd12c28c",
    "source": "synthetic",
    "split": "heldout",
    "target_id": "captcha6"
  },
  {
    "evidence_id": "captcha7",
    "label": "captcha",
    "rater": "synthetic-r1",
    "schema_version": "1.0",
    "snapshot_sha256": "e22bbd5925a8264bea2dc040144314acc166202e126a1f87d2829afbcd12c28c",
    "source": "synthetic",
    "split": "heldout",
    "target_id": "captcha7"
  },
  {
    "evidence_id": "captcha7",
    "label": "captcha",
    "rater": "synthetic-r2",
    "schema_version": "1.0",
    "snapshot_sha256": "e22bbd5925a8264bea2dc040144314acc166202e126a1f87d2829afbcd12c28c",
    "source": "synthetic",
    "split": "heldout",
    "target_id": "captcha7"
  },
  {
    "evidence_id": "challenge0",
    "label": "challenge",
    "rater": "synthetic-r1",
    "schema_version": "1.0",
    "snapshot_sha256": "2affb90491f7a958e2d7470ec76df338e0531681920a95789c6853c39ef3ebff",
    "source": "synthetic",
    "split": "heldout",
    "target_id": "challenge0"
  },
  {
    "evidence_id": "challenge0",
    "label": "challenge",
    "rater": "synthetic-r2",
    "schema_version": "1.0",
    "snapshot_sha256": "2affb90491f7a958e2d7470ec76df338e0531681920a95789c6853c39ef3ebff",
    "source": "synthetic",
    "split": "heldout",
    "target_id": "challenge0"
  },
  {
    "evidence_id": "challenge1",
    "label": "challenge",
    "rater": "synthetic-r1",
    "schema_version": "1.0",